[
  {
    "name": "ANGELA",
    "full_name": "t81dev/ANGELA",
    "html_url": "https://github.com/t81dev/ANGELA",
    "description": null,
    "language": "Python",
    "fork": false,
    "archived": false,
    "default_branch": "main",
    "homepage": null,
    "topics": [],
    "stargazers_count": 0,
    "watchers_count": 0,
    "forks_count": 3,
    "open_issues_count": 1,
    "size": 5566,
    "created_at": "2026-01-19T14:38:19Z",
    "updated_at": "2026-01-25T19:20:13Z",
    "pushed_at": "2026-03-02T14:31:23Z"
  },
  {
    "name": "digital-archaeology",
    "full_name": "t81dev/digital-archaeology",
    "html_url": "https://github.com/t81dev/digital-archaeology",
    "description": "A map of computing's unrealized possibilities—a place where historical artifacts are examined not just for what they were, but for what they might still become.",
    "language": "Python",
    "fork": false,
    "archived": false,
    "default_branch": "main",
    "homepage": null,
    "topics": [],
    "stargazers_count": 3,
    "watchers_count": 3,
    "forks_count": 0,
    "open_issues_count": 0,
    "size": 16697,
    "created_at": "2026-07-24T15:01:05Z",
    "updated_at": "2026-10-07T02:42:19Z",
    "pushed_at": "2026-08-29T19:23:12Z"
  },
  {
    "name": "duotronic-computing",
    "full_name": "t81dev/duotronic-computing",
    "html_url": "https://github.com/t81dev/duotronic-computing",
    "description": "Interpretive and contextual material exploring duotronic computing and the Ternary Logic Unit (TLU). This repository is non-normative and depends on the formal specification at t81dev/duotroic-whitepaper.",
    "language": "C++",
    "fork": false,
    "archived": false,
    "default_branch": "main",
    "homepage": null,
    "topics": [],
    "stargazers_count": 0,
    "watchers_count": 0,
    "forks_count": 1,
    "open_issues_count": 0,
    "size": 104,
    "created_at": "2026-01-24T16:31:03Z",
    "updated_at": "2026-02-15T20:32:28Z",
    "pushed_at": "2026-02-15T20:32:25Z"
  },
  {
    "name": "duotronic-thesis",
    "full_name": "t81dev/duotronic-thesis",
    "html_url": "https://github.com/t81dev/duotronic-thesis",
    "description": null,
    "language": null,
    "fork": false,
    "archived": false,
    "default_branch": "main",
    "homepage": null,
    "topics": [],
    "stargazers_count": 0,
    "watchers_count": 0,
    "forks_count": 0,
    "open_issues_count": 0,
    "size": 51,
    "created_at": "2026-01-25T23:58:32Z",
    "updated_at": "2026-01-26T15:51:39Z",
    "pushed_at": "2026-01-26T15:51:35Z"
  },
  {
    "name": "duotronic-whitepaper",
    "full_name": "t81dev/duotronic-whitepaper",
    "html_url": "https://github.com/t81dev/duotronic-whitepaper",
    "description": "A formal proposal and reference semantics for a ternary logic coprocessor that augments binary systems.",
    "language": null,
    "fork": false,
    "archived": false,
    "default_branch": "main",
    "homepage": "",
    "topics": [],
    "stargazers_count": 0,
    "watchers_count": 0,
    "forks_count": 0,
    "open_issues_count": 0,
    "size": 102,
    "created_at": "2026-01-24T14:53:53Z",
    "updated_at": "2026-02-08T23:32:03Z",
    "pushed_at": "2026-02-08T23:32:00Z"
  },
  {
    "name": "llama.cpp",
    "full_name": "t81dev/llama.cpp",
    "html_url": "https://github.com/t81dev/llama.cpp",
    "description": "LLM inference in C/C++",
    "language": "C++",
    "fork": true,
    "archived": false,
    "default_branch": "master",
    "homepage": "",
    "topics": [],
    "stargazers_count": 0,
    "watchers_count": 0,
    "forks_count": 0,
    "open_issues_count": 0,
    "size": 243188,
    "created_at": "2025-12-12T17:04:46Z",
    "updated_at": "2026-02-09T21:30:53Z",
    "pushed_at": "2026-02-10T05:44:27Z"
  },
  {
    "name": "t81-benchmarks",
    "full_name": "t81dev/t81-benchmarks",
    "html_url": "https://github.com/t81dev/t81-benchmarks",
    "description": "Rigorous comparisons: inference speed/memory/accuracy of T3_K vs Q4/Q5, simulated energy, crypto throughput, etc.",
    "language": "Shell",
    "fork": false,
    "archived": false,
    "default_branch": "main",
    "homepage": null,
    "topics": [],
    "stargazers_count": 0,
    "watchers_count": 0,
    "forks_count": 2,
    "open_issues_count": 8,
    "size": 67,
    "created_at": "2026-02-08T13:57:14Z",
    "updated_at": "2026-10-01T19:34:59Z",
    "pushed_at": "2026-10-01T19:34:55Z"
  },
  {
    "name": "t81-constraints",
    "full_name": "t81dev/t81-constraints",
    "html_url": "https://github.com/t81dev/t81-constraints",
    "description": "Epistemic constraints, assumptions, and failure boundaries governing the t81dev research ecosystem.",
    "language": null,
    "fork": false,
    "archived": false,
    "default_branch": "main",
    "homepage": null,
    "topics": [],
    "stargazers_count": 0,
    "watchers_count": 0,
    "forks_count": 0,
    "open_issues_count": 0,
    "size": 12,
    "created_at": "2026-02-08T13:38:05Z",
    "updated_at": "2026-02-08T23:31:15Z",
    "pushed_at": "2026-02-08T23:31:11Z"
  },
  {
    "name": "t81-docs",
    "full_name": "t81dev/t81-docs",
    "html_url": "https://github.com/t81dev/t81-docs",
    "description": "Central hub with architecture overviews, installation guides, API references, visual explainers of balanced ternary, migration paths from binary, and a unified \"getting started\" for the whole stack.",
    "language": "Shell",
    "fork": false,
    "archived": false,
    "default_branch": "main",
    "homepage": null,
    "topics": [],
    "stargazers_count": 0,
    "watchers_count": 0,
    "forks_count": 2,
    "open_issues_count": 1,
    "size": 43,
    "created_at": "2026-02-08T13:52:45Z",
    "updated_at": "2026-02-09T01:58:00Z",
    "pushed_at": "2026-10-19T14:48:34Z"
  },
  {
    "name": "t81-examples",
    "full_name": "t81dev/t81-examples",
    "html_url": "https://github.com/t81dev/t81-examples",
    "description": "Curated demo",
    "language": "Shell",
    "fork": false,
    "archived": false,
    "default_branch": "main",
    "homepage": null,
    "topics": [],
    "stargazers_count": 0,
    "watchers_count": 0,
    "forks_count": 0,
    "open_issues_count": 1,
    "size": 13,
    "created_at": "2026-02-08T13:56:15Z",
    "updated_at": "2026-02-09T01:58:02Z",
    "pushed_at": "2026-02-09T01:49:25Z"
  },
  {
    "name": "t81-foundation",
    "full_name": "t81dev/t81-foundation",
    "html_url": "https://github.com/t81dev/t81-foundation",
    "description": "T81 is the first operating system built for governed, deterministic AI inference — ternary weights, bit-exact reproducibility, pre-side-effect policy enforcement, and immutable content-addressed storage.",
    "language": "C++",
    "fork": false,
    "archived": false,
    "default_branch": "main",
    "homepage": "https://t81dev.github.io/t81-foundation/",
    "topics": [
      "agi",
      "ai-safety",
      "arbitrary-precision",
      "balanced-ternary",
      "compiler",
      "cpp",
      "domain-specific-language",
      "emulator",
      "intermediate-representation",
      "programmiing-language",
      "systems-programming",
      "t81",
      "tensor-algebra",
      "ternary-computing",
      "virtual-machine"
    ],
    "stargazers_count": 4,
    "watchers_count": 4,
    "forks_count": 5,
    "open_issues_count": 14,
    "size": 131494,
    "created_at": "2025-11-21T22:25:00Z",
    "updated_at": "2026-10-16T10:26:14Z",
    "pushed_at": "2026-10-16T10:26:09Z"
  },
  {
    "name": "t81-hardware",
    "full_name": "t81dev/t81-hardware",
    "html_url": "https://github.com/t81dev/t81-hardware",
    "description": "Verilog/VHDL simulations, testbenches, FPGA targeting scripts, or even a software emulator of the ternary co-processor.",
    "language": "SystemVerilog",
    "fork": false,
    "archived": false,
    "default_branch": "main",
    "homepage": null,
    "topics": [],
    "stargazers_count": 1,
    "watchers_count": 1,
    "forks_count": 2,
    "open_issues_count": 0,
    "size": 170,
    "created_at": "2026-02-08T13:59:19Z",
    "updated_at": "2026-10-19T13:24:43Z",
    "pushed_at": "2026-10-19T13:24:38Z"
  },
  {
    "name": "t81-lang",
    "full_name": "t81dev/t81-lang",
    "html_url": "https://github.com/t81dev/t81-lang",
    "description": "T81Lang: the deterministic, balanced-ternary domain-specific language for the T81 ecosystem. Compiles to TISC IR and bytecode for HanoiVM execution with Axion safety guarantees.",
    "language": "C++",
    "fork": false,
    "archived": false,
    "default_branch": "main",
    "homepage": null,
    "topics": [],
    "stargazers_count": 0,
    "watchers_count": 0,
    "forks_count": 0,
    "open_issues_count": 0,
    "size": 199,
    "created_at": "2026-02-08T15:42:17Z",
    "updated_at": "2026-02-09T20:18:00Z",
    "pushed_at": "2026-02-09T20:17:56Z"
  },
  {
    "name": "t81-python",
    "full_name": "t81dev/t81-python",
    "html_url": "https://github.com/t81dev/t81-python",
    "description": "High-level Python package on PyPI with clean APIs, type hints, and integration examples (e.g., with Hugging Face or llama.cpp Python bindings).",
    "language": "Python",
    "fork": false,
    "archived": false,
    "default_branch": "main",
    "homepage": null,
    "topics": [],
    "stargazers_count": 0,
    "watchers_count": 0,
    "forks_count": 0,
    "open_issues_count": 0,
    "size": 68,
    "created_at": "2026-02-08T13:58:07Z",
    "updated_at": "2026-02-08T23:21:02Z",
    "pushed_at": "2026-02-08T23:20:59Z"
  },
  {
    "name": "t81-roadmap",
    "full_name": "t81dev/t81-roadmap",
    "html_url": "https://github.com/t81dev/t81-roadmap",
    "description": "Public vision document, milestone tracking, contribution guidelines, and discussion of bigger picture (e.g., ternary-native ASICs, integration with quantum ideas, AGI implications).",
    "language": "Shell",
    "fork": false,
    "archived": false,
    "default_branch": "main",
    "homepage": null,
    "topics": [],